1555980570013966341,1555980570013966341,2022-08-06 21:14:11 EEST,2022-08-06,21:14:11,+0300,828751136735760384,inlovewithsock,мàйон 🇺🇦,,Зайшла в сільпо і офігіла скільки там корейських товарів. В нас новий торгівельний партнер?,uk,[],[],[],0,0,0,[],[],https://twitter.com/inlovewithsock/status/1555980570013966341,False,,0,,,,,,,,[],,,,
1555968783847768064,1555836935419166721,2022-08-06 20:27:21 EEST,2022-08-06,20:27:21,+0300,1261758380470947841,fop_jss,Джізус Троєщинського Патріархату ловить карася,,@monyaforeve @fucman65 @lemberg_15 А я вже порізану в сільпо беру,uk,[],[],[],2,0,3,[],[],https://twitter.com/FOP_JSS/status/1555968783847768064,False,,0,,,,,,,,"[{'screen_name': 'monyaforeve', 'name': 'Мoникa Янєлox ☣', 'id': '1526811111386927110'}, {'screen_name': 'fucman65', 'name': 'хуй', 'id': '1214223911178526720'}, {'screen_name': 'lemberg_15', 'name': 'Лісовий Брат🇺🇦', 'id': '806404842793107456'}]",,,,
1555967361257291779,1555966454411005955,2022-08-06 20:21:42 EEST,2022-08-06,20:21:42,+0300,1499797685200637965,marichechko,кавове зернятко,,"Пам'ятаю як доводилось працювати усе літо в колл центрі, щоб зібрати себе в 11 клас) І як доводилось в кінці школи працювати в сільпо, щоб здати гроші на випускний))",uk,[],[],[],1,0,0,[],[],https://twitter.com/marichechko/status/1555967361257291779,False,,0,,,,,,,,[],,,,
1555950264674385922,1555950264674385922,2022-08-06 19:13:45 EEST,2022-08-06,19:13:45,+0300,1273183225427435526,ukrainianorange,дзиґар 🇺🇦ꑭ і кляте кабаре,,як добре що я жінка-розчарування для чоловіків миюсь шампунем з сільпо за 100 грн і гелем для душу за 40,uk,[],[],[],0,0,6,[],[],https://twitter.com/ukrainianorange/status/1555950264674385922,False,https://twitter.com/purizhochok/status/1555894307718144000,0,,,,,,,,[],,,,
1555944026280497153,1555931186811248643,2022-08-06 18:48:58 EEST,2022-08-06,18:48:58,+0300,1108457062974009345,miwch3,мiвiна 🇺🇦,,@solsikkkee ААА Я ЇХ ТЕЖ У СІЛЬПО КОЛИСЬ КУПУВАЛА ТО ЛЕГЕНДА,uk,[],[],[],1,0,1,[],[],https://twitter.com/Miwch3/status/1555944026280497153,False,,0,,,,,,,,"[{'screen_name': 'solsikkkee', 'name': 'рест 🥱 соля вмерла', 'id': '1300873705057406977'}]",,,,
1555940327319642117,1555937059847684096,2022-08-06 18:34:16 EEST,2022-08-06,18:34:16,+0300,2727111767,auchapeaunoir,Чорний капелюшок,,"@taranenko Нічого собі, вчора в Сільпо бачили більше 100грн",uk,[],[],[],0,0,1,[],[],https://twitter.com/auchapeaunoir/status/1555940327319642117,False,,0,,,,,,,,"[{'screen_name': 'taranenko', 'name': 'Амбасадор Троєщини', 'id': '17460630'}]",,,,
1555938333372682241,1555938333372682241,2022-08-06 18:26:21 EEST,2022-08-06,18:26:21,+0300,1351829078681276490,pani_liho,Пані Лихо 🇺🇦,,"До речі, в мене є для вас дещо цікавеньке.  У магазинах сільпо дуже весело клеять знижку 50% на товар і зривають термін придатності.  Шкода, що саме в цьому випадку, працівник не дуже уважно поставився до своєї роботи і можна побачити, що продукт, по суті, зіпсувався.  https://t.co/jegCrV7xbN",uk,[],[],['https://pbs.twimg.com/media/FZfNqt4WYAItF0B.jpg'],1,2,24,[],[],https://twitter.com/pani_liho/status/1555938333372682241,False,,1,https://pbs.twimg.com/media/FZfNqt4WYAItF0B.jpg,,,,,,,[],,,,
1555938304092213249,1555865110190727168,2022-08-06 18:26:14 EEST,2022-08-06,18:26:14,+0300,1091694757238267905,bringmethekit,котомамка🇺🇦 #ꑭ,,@grizzz_24 там є спар??? я думала там сільпо чи атб..,uk,[],[],[],1,0,1,[],[],https://twitter.com/BringMeTheKit/status/1555938304092213249,False,,0,,,,,,,,"[{'screen_name': 'grizzz_24', 'name': 'п і л і ґ р и м ~', 'id': '1079306256169476096'}]",,,,
1555937753489149953,1555936440286154753,2022-08-06 18:24:03 EEST,2022-08-06,18:24:03,+0300,2915381811,compozitor77,Їжачок в блєдінє,,"@nezgraba_ Ходімо в Сільпо, там візьмемо господарське дешевше",uk,[],[],[],1,0,0,[],[],https://twitter.com/Compozitor77/status/1555937753489149953,False,,0,,,,,,,,"[{'screen_name': 'nezgraba_', 'name': 'Незґраба', 'id': '972965099446112256'}]",,,,
1555937488367230977,1555935030714798081,2022-08-06 18:22:59 EEST,2022-08-06,18:22:59,+0300,1362569172102840321,inspektorkit__,інспектор кіт,,@CudoVperte @tse_ne_ia @heart_headed я миюсь Dove з Сільпо,uk,[],[],[],7,0,14,[],[],https://twitter.com/inspektorkit__/status/1555937488367230977,False,,0,,,,,,,,"[{'screen_name': 'CudoVperte', 'name': 'Вперте Чудо🇺🇦', 'id': '1507009123455438848'}, {'screen_name': 'tse_ne_ia', 'name': 'час збирати каміння', 'id': '2866917681'}, {'screen_name': 'heart_headed', 'name': 'Жіночка в шортах', 'id': '204982750'}]",,,,
1555936982035046402,1555697253959942145,2022-08-06 18:20:59 EEST,2022-08-06,18:20:59,+0300,1222930979913945088,tramvaychik,трамвайчик 🇺🇦,,"@_OFF_ToTheRaces Читаю і радію, що поблизу ніде нема Сільпо, бо місця в хаті на то вже тоже нема",uk,[],[],[],1,0,1,[],[],https://twitter.com/tramvaychik/status/1555936982035046402,False,,0,,,,,,,,"[{'screen_name': '_OFF_ToTheRaces', 'name': 'Б Е Н Т Е Г А на роботі', 'id': '2305792847'}]",,,,
1555936565347622919,1555936565347622919,2022-08-06 18:19:19 EEST,2022-08-06,18:19:19,+0300,1139564929890103296,kakazemir,🇺🇦Принцеса Піздося🇺🇦,,"Я сто років не їла оселедця під шубою. І зараз ми взяли його в сільпо і я просто бляха не можу, як це смачно. Може я крінж, але я вільна. І щаслива",uk,[],[],[],0,0,0,[],[],https://twitter.com/KaKazemir/status/1555936565347622919,False,,0,,,,,,,,[],,,,
1555936373865168896,1555576603266228225,2022-08-06 18:18:34 EEST,2022-08-06,18:18:34,+0300,918385293539102720,oj_vso,ой всьо 🇺🇦,,"@Akdmeh Все ж просто: хто не може ходити у Сільпо, нехай ходить у Goodwine.",uk,[],[],[],0,0,2,[],[],https://twitter.com/oj_vso/status/1555936373865168896,False,,0,,,,,,,,"[{'screen_name': 'Akdmeh', 'name': 'Андрій з качечкою🦆', 'id': '70098903'}]",,,,
1555921688939958282,1555810860781764609,2022-08-06 17:20:12 EEST,2022-08-06,17:20:12,+0300,170439346,stargooner,Star,,@Kovbasa717 я цю в сільпо купив. а на початку весни була як гуманітарка в нас.,uk,[],[],[],0,0,0,[],[],https://twitter.com/stargooner/status/1555921688939958282,False,,0,,,,,,,,"[{'screen_name': 'Kovbasa717', 'name': 'ЖовтоСиніМешти ꑭ', 'id': '1325290027178467328'}]",,,,
1555919232579391488,1555916142828552192,2022-08-06 17:10:27 EEST,2022-08-06,17:10:27,+0300,2569152335,eduard_daily,спрощений фоп🇹🇼🇽🇰,,"@nuclearyear бля, до речі польські монстри вже навіть в сільпо з’явились по 60 грн за 0,5",uk,[],[],[],2,0,8,[],[],https://twitter.com/eduard_daily/status/1555919232579391488,False,,0,,,,,,,,"[{'screen_name': 'nuclearyear', 'name': 'Iꑭto the abyss🌻', 'id': '1533158348572479488'}]",,,,
1555916961044959234,1555916416381063168,2022-08-06 17:01:25 EEST,2022-08-06,17:01:25,+0300,1538601393757511680,neth3rpand4s,yannkel🇺🇦,,@eeloria я бачив у нас в сільпо у нас вони дорожче аніж з патрулем,uk,[],[],[],0,0,2,[],[],https://twitter.com/NETH3RPAND4S/status/1555916961044959234,False,,0,,,,,,,,"[{'screen_name': 'eeloria', 'name': 'гера 69 #SaveAzovstal 🇺🇦', 'id': '1258147425069543426'}]",,,,
1555906432012374017,1555906432012374017,2022-08-06 16:19:35 EEST,2022-08-06,16:19:35,+0300,1213565875837497344,elena_foxy,🇺🇦 Паꑭі Л.,,"Може, все ж таки, зняти кімнату у Польщі не така вже і погана ідея.  У Сільпо гарні валізи продаються, піду куплю.  https://t.co/ruwneV4t0C",uk,[],[],['https://pbs.twimg.com/media/FZewp1xXkAAjDIQ.jpg'],2,0,5,[],[],https://twitter.com/Elena_Foxy/status/1555906432012374017,False,,1,https://pbs.twimg.com/media/FZewp1xXkAAjDIQ.jpg,,,,,,,[],,,,
1555900838647848967,1555900838647848967,2022-08-06 15:57:21 EEST,2022-08-06,15:57:21,+0300,324254261,twufau,фау,,"сценькались корзинками в сільпо у відділі з сухариками, так і познайомились",uk,[],[],[],0,0,1,[],[],https://twitter.com/twufau/status/1555900838647848967,False,,0,,,,,,,,[],,,,
1555900822214610944,1555900621626216448,2022-08-06 15:57:17 EEST,2022-08-06,15:57:17,+0300,3058522388,nensi_mur,вікторія🇺🇦,,@vashlogist коли ти будеш амбасодором сільпо?,uk,[],[],[],1,0,1,[],[],https://twitter.com/nensi_mur/status/1555900822214610944,False,,0,,,,,,,,"[{'screen_name': 'vashlogist', 'name': 'кицюш, да ето так🇺🇦', 'id': '1465422343577210889'}]",,,,
1555900621626216448,1555900621626216448,2022-08-06 15:56:30 EEST,2022-08-06,15:56:30,+0300,1465422343577210889,vashlogist,"кицюш, да ето так🇺🇦",,"ну я в сільпо йду гарна, щоб вони зрозуміли, кого втратили",uk,[],[],[],2,0,9,[],[],https://twitter.com/vashlogist/status/1555900621626216448,False,,0,,,,,,,,[],,,,
1555899553106300928,1555899553106300928,2022-08-06 15:52:15 EEST,2022-08-06,15:52:15,+0300,543519834,heyserbernar,пітоняшка 🇺🇦,,В ЛЄ СІЛЬПО!,uk,[],[],[],2,1,16,[],[],https://twitter.com/heyserbernar/status/1555899553106300928,False,https://twitter.com/vashlogist/status/1555899187153313792,0,,,,,,,,[],,,,
1555899187153313792,1555899187153313792,2022-08-06 15:50:48 EEST,2022-08-06,15:50:48,+0300,1465422343577210889,vashlogist,"кицюш, да ето так🇺🇦",,- куди ти йдеш така гарна? - в сільпо,uk,[],[],[],0,0,4,[],[],https://twitter.com/vashlogist/status/1555899187153313792,False,,0,,,,,,,,[],,,,
1555898133451886593,1555557972260134914,2022-08-06 15:46:36 EEST,2022-08-06,15:46:36,+0300,1123169497018449921,glazasvelo,glazasvelo,,"@ExhaustedStude1 Пошукай або у сільпо  Або є магазини по типу, їжа з Европи і тд Я зараз купую в сільпо і там майже кожного тижня , знижки на нього",uk,[],[],[],1,0,0,[],[],https://twitter.com/glazasvelo/status/1555898133451886593,False,,0,,,,,,,,"[{'screen_name': 'ExhaustedStude1', 'name': 'ExhaustedStudent', 'id': '1190566559720316929'}]",,,,
1555895284001132547,1555586431489347587,2022-08-06 15:35:17 EEST,2022-08-06,15:35:17,+0300,983390603202514945,olenabek60,Олена Бек Самурай,,"@Elena604 Гречка у сільпо 87.89, рис найдешевший 54",uk,[],[],[],0,0,1,[],[],https://twitter.com/OlenaBek60/status/1555895284001132547,False,,0,,,,,,,,"[{'screen_name': 'Elena604', 'name': 'Hel60', 'id': '1497135346693386240'}]",,,,
1555880211027312641,1555880211027312641,2022-08-06 14:35:23 EEST,2022-08-06,14:35:23,+0300,1184015943388794880,stbst_,st,,"субота: позбувся 2-ох книг, сходив в Сільпо за продуктами, купив різних дурниць для себе, замовив нову футболку в дизайнерки з Дрогобича…одним словом гарний день, принаймі кращий ніж вчора)",uk,[],[],[],0,0,4,[],[],https://twitter.com/stbst_/status/1555880211027312641,False,,0,,,,,,,,[],,,,
1555877258262450181,1555877258262450181,2022-08-06 14:23:39 EEST,2022-08-06,14:23:39,+0300,893546544821145600,teheidoma,🇺🇦 хейтспіч енджоєр 🇺🇦,,"Україна країна майбутнього я звідси ніколи не виїду  по-перше вершина сучасних технологій, сільпо в кропивницькому дає на клика всій сіліконовій долині одночасно.. і працівники нової пошти святіші за папу римського я такий щасливий",uk,[],[],[],0,0,1,[],[],https://twitter.com/teheidoma/status/1555877258262450181,False,,0,,,,,,,,[],,,,
1555874527678238723,1555874527678238723,2022-08-06 14:12:48 EEST,2022-08-06,14:12:48,+0300,835233908975357952,minsularis,"миколай, але ꑭе святий🇺🇦❤️🖤",,шось додаток сільпо на хокку пробило  https://t.co/DMp8yqaCIA,uk,[],[],['https://pbs.twimg.com/media/FZeToy9WIAE65iy.jpg'],0,0,7,[],[],https://twitter.com/minsularis/status/1555874527678238723,False,,1,https://pbs.twimg.com/media/FZeToy9WIAE65iy.jpg,,,,,,,[],,,,
1555873889825193984,1555873889825193984,2022-08-06 14:10:16 EEST,2022-08-06,14:10:16,+0300,1022575478,jacksonangelina,лінок,,Мій раціон складається виключно з акційних продуктів з Сільпо,uk,[],[],[],0,0,2,[],[],https://twitter.com/JacksonAngelina/status/1555873889825193984,False,,0,,,,,,,,[],,,,
1555871162529349632,1555871162529349632,2022-08-06 13:59:26 EEST,2022-08-06,13:59:26,+0300,2451925176,mihalbabic,Mihal Babić,,я вже подумав сільпо стало зумером  https://t.co/tgSjekazPv,uk,[],[],['https://pbs.twimg.com/media/FZeQkxtXoAEYXJO.jpg'],0,0,1,[],[],https://twitter.com/mihalbabic/status/1555871162529349632,False,,1,https://pbs.twimg.com/media/FZeQkxtXoAEYXJO.jpg,,,,,,,[],,,,
1555862593423740928,1555858934270918656,2022-08-06 13:25:23 EEST,2022-08-06,13:25:23,+0300,108398097,lilighterald,Лілія Білецька,,@findp_ua ого. в Сільпо по 100 грн за кілограм. і це вже український цьогорічний врожай.,uk,[],[],[],1,0,1,[],[],https://twitter.com/lilighterald/status/1555862593423740928,False,,0,,,,,,,,"[{'screen_name': 'findp_ua', 'name': 'Igor', 'id': '287356039'}]",,,,
1555853431197384704,1555851355574738944,2022-08-06 12:48:59 EEST,2022-08-06,12:48:59,+0300,19076376,andriyfurdylo,Andriy Furdylo,,@Kievsky_ Фора/Сільпо там де морожена риба. Ще буває в Ашані і наче в Новусі,uk,[],[],[],0,0,3,[],[],https://twitter.com/andriyfurdylo/status/1555853431197384704,False,,0,,,,,,,,"[{'screen_name': 'Kievsky_', 'name': 'ꑭ ічого Святого', 'id': '627850349'}]",,,,
1555852723765088257,1555852719130378240,2022-08-06 12:46:10 EEST,2022-08-06,12:46:10,+0300,1408407177291866115,l4kkss4,алекса!!!🇺🇦,,ну як нормальним хоча б з сільпо було б дуже добре,uk,[],[],[],0,0,2,[],[],https://twitter.com/l4kkss4/status/1555852723765088257,False,,0,,,,,,,,[],,,,
1555852545305841666,1555852545305841666,2022-08-06 12:45:27 EEST,2022-08-06,12:45:27,+0300,845910959239708674,club_pizdets,Конотопська відьма,,Я так хочу пончиків з сільпо це пизда😭😭😭😭,ru,[],[],[],0,0,1,[],[],https://twitter.com/club_pizdets/status/1555852545305841666,False,,0,,,,,,,,[],,,,
1555850737426599936,1555827926574178304,2022-08-06 12:38:16 EEST,2022-08-06,12:38:16,+0300,1108764276880297986,rosemaric3,rosemaric,,@f0_fl @ihorko_bk Вчора купив лисички в сільпо),uk,[],[],[],2,0,3,[],[],https://twitter.com/rosemaric3/status/1555850737426599936,False,,0,,,,,,,,"[{'screen_name': 'f0_fl', 'name': 'у полоні печалі💙💛', 'id': '3656572216'}, {'screen_name': 'ihorko_bk', 'name': '○', 'id': '338308588'}]",,,,
1555845064533938178,1555223163763654658,2022-08-06 12:15:44 EEST,2022-08-06,12:15:44,+0300,2468110104,bachinskiyb,🐷🐶 IDI NAHYI from 🇺🇦,,"@riprv Цікаво, зараз в сільпо продають гречку за 100 грн. ПП як масон, встановлює ціни у себе і в інших)",uk,[],[],[],1,0,1,[],[],https://twitter.com/BachinskiyB/status/1555845064533938178,False,,0,,,,,,,,"[{'screen_name': 'riprv', 'name': 'RIPRV', 'id': '1027305062996029440'}]",,,,
1555838329186578434,1555806451561648130,2022-08-06 11:48:58 EEST,2022-08-06,11:48:58,+0300,2727111767,auchapeaunoir,Чорний капелюшок,,@Iaroslaav Шо почом. Хоча у вас там мабуть все дешеве. Бо в Сільпо 100 щось біля 40 грн,uk,[],[],[],1,0,0,[],[],https://twitter.com/auchapeaunoir/status/1555838329186578434,False,,0,,,,,,,,"[{'screen_name': 'Iaroslaav', 'name': 'Чорний пастор', 'id': '462775432'}]",,,,
1555833263985512453,1555833263985512453,2022-08-06 11:28:50 EEST,2022-08-06,11:28:50,+0300,1161623794970222592,kstnk_a,Суцільний прикол.,,Романтичний сніданок у Сільпо👨‍👩‍👧  https://t.co/AM1hKQSUI6,uk,[],[],['https://pbs.twimg.com/media/FZduGHeXEAArLAC.jpg'],1,0,4,[],[],https://twitter.com/kstnk_a/status/1555833263985512453,False,,1,https://pbs.twimg.com/media/FZduGHeXEAArLAC.jpg,,,,,,,[],,,,
1555833038734610433,1555833038734610433,2022-08-06 11:27:57 EEST,2022-08-06,11:27:57,+0300,2845474222,pidorwave,"хто, як не тьотя🇺🇦груша",,"згадала смішну штуку з переписки, тіпа ""нужно продавать твої работи через інтернет, или работать касіром в сельпо""   IF ONLY вона знала, що в усіх сільпо де я буваю, висять оголошення аля ""вакансій нема, але ви тримайтесь заради перемоги""",uk,[],[],[],0,0,0,[],[],https://twitter.com/pidorwave/status/1555833038734610433,False,,0,,,,,,,,[],,,,
1555829358870536192,1555829358870536192,2022-08-06 11:13:19 EEST,2022-08-06,11:13:19,+0300,1468323235720843267,verrtebny,Ivan Vertebny,,"Самокаса в Сільпо після оплати каже «Слава Україні», я їй машинально відповів 🫡🇺🇦",uk,[],[],[],0,0,3,[],[],https://twitter.com/verrtebny/status/1555829358870536192,False,,0,,,,,,,,[],,,,
1555821357413404674,1555821357413404674,2022-08-06 10:41:32 EEST,2022-08-06,10:41:32,+0300,324834925,nanivna_,Ханна_ридає в подушку_вгаласіну,,"Із розваг: прогулянка в ""Сільпо"", розглядання пейзажу, оминання сусідів, прибирання хати, я задовбалась.",uk,[],[],[],0,0,3,[],[],https://twitter.com/nanivna_/status/1555821357413404674,False,,0,,,,,,,,[],,,,
1555820997726576640,1555820023574315008,2022-08-06 10:40:06 EEST,2022-08-06,10:40:06,+0300,1362569172102840321,inspektorkit__,інспектор кіт,,@sonia_redpanda в сільпо на ГД,ru,[],[],[],1,0,1,[],[],https://twitter.com/inspektorkit__/status/1555820997726576640,False,,0,,,,,,,,"[{'screen_name': 'sonia_redpanda', 'name': 'Соня Панда', 'id': '767448020787093505'}]",,,,
1555808793455386624,1555807267450232833,2022-08-06 09:51:36 EEST,2022-08-06,09:51:36,+0300,1519409512624570368,san4es1mr,mrSan4es1,,"коли жалко викидати іграшки з ""Сільпо"",а новий шатл ще не обран,вони,тобто.іграшки йдуть на ""обвєс""🤣🤣🤣  https://t.co/eCLgZLAZ2V",uk,[],[],['https://pbs.twimg.com/media/FZdXDdYXEAEhfJ4.jpg'],1,0,2,[],[],https://twitter.com/San4es1Mr/status/1555808793455386624,False,,1,https://pbs.twimg.com/media/FZdXDdYXEAEhfJ4.jpg,,,,,,,[],,,,
1555806310507094017,1555806272544538624,2022-08-06 09:41:44 EEST,2022-08-06,09:41:44,+0300,4343360253,anasteeiga,неупокорена душа,,І ще й «Сільпо»!,uk,[],[],[],0,0,1,[],[],https://twitter.com/Anasteeiga/status/1555806310507094017,False,,0,,,,,,,,[],,,,
1555790345732063232,1555426402064900097,2022-08-06 08:38:18 EEST,2022-08-06,08:38:18,+0300,1421175549624455176,pmwithmems,ця булочка made in Ukraine🇺🇦,,"Чи могла я колись уявити, що наявність Сільпо, АТБ та інших магазинів будуть викликати у мене надзвичайну радість...  А спонсор мого дикунства - проживання 4 місяці в смт. СМТ - ти будеш ридати як сучка, коли побачиш супермаркет.",uk,[],[],[],1,0,2,[],[],https://twitter.com/PMwithMems/status/1555790345732063232,False,,0,,,,,,,,[],,,,
1555780841606987776,1555780841606987776,2022-08-06 08:00:32 EEST,2022-08-06,08:00:32,+0300,2780775391,akzentzaporozhe,Акцент,,"У ""Сільпо"" показали найпопулярніші товари влітку 2022 - Портал Акцент -  https://t.co/DCV5WvATE3  https://t.co/CCaqd7G69c",uk,[],['https://akzent.zp.ua/u-silpo-pokazali-najpopulyarnishi-tovari-vlitku-2022/'],['https://pbs.twimg.com/media/FZc-bgqWAAAWXNg.jpg'],0,0,0,[],[],https://twitter.com/AkzentZaporozhe/status/1555780841606987776,False,,1,https://pbs.twimg.com/media/FZc-bgqWAAAWXNg.jpg,,,,,,,[],,,,
1555704644013367297,1555703630724059136,2022-08-06 02:57:45 EEST,2022-08-06,02:57:45,+0300,1017079332622172160,shurchukk,скажи шо воно здохло,,"can't stop thinking about ці соняхи, які я того року бачила в бабуськи під Сільпо  але на Бориспільську я заради них не поїду..........  https://t.co/je6WEUWuQn",uk,[],[],['https://pbs.twimg.com/media/FZb5IO0XEAAZCkA.jpg'],0,0,1,[],[],https://twitter.com/shurchukk/status/1555704644013367297,False,,1,https://pbs.twimg.com/media/FZb5IO0XEAAZCkA.jpg,,,,,,,[],,,,
1555697253959942145,1555697253959942145,2022-08-06 02:28:23 EEST,2022-08-06,02:28:23,+0300,2305792847,_off_totheraces,Б Е Н Т Е Г А на роботі,,"Я не знаю чи ви знали, але в сільпо якісь дивні і дуже великі знижки. Я з думкою про те, що мені нічого не треба, купив 1 велику чашку і набір із чашки та глибокої тарілки в одному кольорі Так, я жертва маркетингу. Так, окрім цих горнят, я маю ще 6. В господарстві все знадобиться",uk,[],[],[],1,0,12,[],[],https://twitter.com/_OFF_ToTheRaces/status/1555697253959942145,False,,0,,,,,,,,[],,,,
1555675554883534848,1555671885152649216,2022-08-06 01:02:09 EEST,2022-08-06,01:02:09,+0300,1443304219788943365,kiyspo,неспокійне буття,,"на касі сільпо залишила 400 грн (хз як так, по класиці нічого толком не взяла), голос з апарату подякував за покупку і сказав на прощання «слава україні», а передбачення гласило: «нас слухають, нас чують». мабуть, того все це зараз і розповідаю.",uk,[],[],[],1,0,0,[],[],https://twitter.com/kiyspo/status/1555675554883534848,False,,0,,,,,,,,[],,,,
1555652005800050689,1555571722778198016,2022-08-05 23:28:35 EEST,2022-08-05,23:28:35,+0300,1342220321416503297,rougahou,🇺🇦ніхто не помре цнотливим,,@naggingg завтра в 30-градусну жару попрямую в сільпо і мене нічого не зупинить,uk,[],[],[],1,0,1,[],[],https://twitter.com/rougahou/status/1555652005800050689,False,,0,,,,,,,,"[{'screen_name': 'naggingg', 'name': 'зла відьма', 'id': '1525389314296795136'}]",,,,
1555651850321403904,1555571722778198016,2022-08-05 23:27:58 EEST,2022-08-05,23:27:58,+0300,1525389314296795136,naggingg,зла відьма,,"@rougahou Я його знайшла у сільпо,до цього не бачила там",uk,[],[],[],1,0,1,[],[],https://twitter.com/naggingg/status/1555651850321403904,False,,0,,,,,,,,"[{'screen_name': 'rougahou', 'name': '🇺🇦ніхто не помре цнотливим', 'id': '1342220321416503297'}]",,,,
1555640206564491265,1555603989139537920,2022-08-05 22:41:42 EEST,2022-08-05,22:41:42,+0300,1548209507062362115,mkush8819,m.kush,,"@odarkovka Ото влучно,так і залишимо. Всьо надо починать продавать в Сільпо і АТБ",uk,[],[],[],0,0,1,[],[],https://twitter.com/mkush8819/status/1555640206564491265,False,,0,,,,,,,,"[{'screen_name': 'odarkovka', 'name': 'Настіннячко', 'id': '53478899'}]",,,,
