1557405115446923265,1557405115446923265,2022-08-10 19:34:49 EEST,2022-08-10,19:34:49,+0300,445692069,mrrgrte,слава ісу і зсу 🇺🇦,,у сільпо новий рік 🙃  і хлопушки 🤬  https://t.co/0kTYFKemZU,uk,[],[],['https://pbs.twimg.com/media/FZ0Dsh3WAAMnfoz.jpg'],0,0,0,[],[],https://twitter.com/mrrgrte/status/1557405115446923265,False,,1,https://pbs.twimg.com/media/FZ0Dsh3WAAMnfoz.jpg,,,,,,,[],,,,
1557403514837647360,1557022701239341062,2022-08-10 19:28:27 EEST,2022-08-10,19:28:27,+0300,1486619121227870209,evgenijmikolaj1,кучерявий легінь,,"@DokiDokiPidoras в мене була ідентична ситуація, я працював в сільпо і в мене підходить солідно вдягнутий дідусь і каже, що не може зважити лимони бо їх немає, я підходжу допомогти а там уведено «ЛІМОН» (і це все в центрі Львова було)",uk,[],[],[],0,0,0,[],[],https://twitter.com/EvgenijMikolaj1/status/1557403514837647360,False,,0,,,,,,,,"[{'screen_name': 'DokiDokiPidoras', 'name': 'Doki Doki будівник', 'id': '1405474752'}]",,,,
1557371677549498370,1557324705098522625,2022-08-10 17:21:57 EEST,2022-08-10,17:21:57,+0300,1168242565977706496,__coffee_lover_,🌸абрикосова булочка‧₊˚૮꒰˵•ᵜ•˵꒱ა‧₊,,"@shshaffa Пізда якась, кожен день бачу як у нас біля всіх Сільпо в Одесі загружають гуманітарку у Миколаїв і там не тільки вода...де це все",uk,[],[],[],0,0,1,[],[],https://twitter.com/__coffee_lover_/status/1557371677549498370,False,,0,,,,,,,,"[{'screen_name': 'shshaffa', 'name': '🇺🇦 настка // шафа', 'id': '1217078355306205184'}]",,,,
1557370103297196032,1554546961298386944,2022-08-10 17:15:41 EEST,2022-08-10,17:15:41,+0300,460430369,sasha_ssnn,seashell,,"Улюблений сніданок цього літа. Смачний хліб (тут з куркумою з Сільпо), песто, тушковані помідори з цибулею (опційно), запечений баклажан, свіжий помідор, моцарела. На 10 хв в духовку, а потім зверху базилік покласти 🌿 P.S. Якщо любите — натріть хліб часником) #кухня_мушлі  https://t.co/iCrkxGH3KQ",uk,[],[],['https://pbs.twimg.com/media/FZzj2wMXEAEySSg.jpg'],0,0,10,['кухня_мушлі'],[],https://twitter.com/sasha_ssnn/status/1557370103297196032,False,,1,https://pbs.twimg.com/media/FZzj2wMXEAEySSg.jpg,,,,,,,[],,,,
1557368975885058049,1557198217850257411,2022-08-10 17:11:13 EEST,2022-08-10,17:11:13,+0300,1203233805106077696,artur02337628,Artandil,,"@Ulia___Ulia @UKRINFORM Та не гоні на скумбрію... Чьотка риба... Купую в сільпо на вечерю жарану... Смакота, ще й омега3 подгон)",uk,[],[],[],0,0,0,[],[],https://twitter.com/Artur02337628/status/1557368975885058049,False,,0,,,,,,,,"[{'screen_name': 'Ulia___Ulia', 'name': 'Юлия', 'id': '1498676598068891661'}, {'screen_name': 'UKRINFORM', 'name': 'Ukrinform', 'id': '167317309'}]",,,,
1557364332350013440,1557359253299535877,2022-08-10 16:52:45 EEST,2022-08-10,16:52:45,+0300,225618832,uanna_deepum,🇺🇦ꑭ🚀}¯\_〳 •̀ o •́ 〵_/¯,,"@stasbb_ в них є один вагомий МІНУС. це не такі каси як в ашані, це такі як в варусі і сільпо. такі де ти не можеш складати товар в сумку і вона з тобой говорить і всі каси поряд теж",uk,[],[],[],1,0,0,[],[],https://twitter.com/Uanna_Deepum/status/1557364332350013440,False,,0,,,,,,,,"[{'screen_name': 'stasbb_', 'name': 'намистинка :(:', 'id': '2550170088'}]",,,,
1557359804783403016,1557325352808103938,2022-08-10 16:34:46 EEST,2022-08-10,16:34:46,+0300,1553835579707621378,_rtby_,🎩Finn✨,,"@_ortynska А це мережа супермаркетів на кшталт Фори або Сільпо. Воно просто не в багатьох містах ще є, бо воно ще відносно молоде",uk,[],[],[],1,0,1,[],[],https://twitter.com/_rtby_/status/1557359804783403016,False,,0,,,,,,,,"[{'screen_name': '_ortynska', 'name': 'ortynskaya🌌', 'id': '1435670543508901888'}]",,,,
1557359035682328576,1557358139871301642,2022-08-10 16:31:43 EEST,2022-08-10,16:31:43,+0300,1247940142167404544,bltksenia,ксюня,,і ще будинок іграшок та гігантське сільпо,uk,[],[],[],0,0,0,[],[],https://twitter.com/BltKsenia/status/1557359035682328576,False,,0,,,,,,,,[],,,,
1557356056497606656,1557356056497606656,2022-08-10 16:19:52 EEST,2022-08-10,16:19:52,+0300,854716071642845184,wildastronaut,Астронавт,,"Альо, розетка, атб, сільпо, укрпошта, хто там ще блядь? Ваш вихід з логотипами:",uk,[],[],[],0,0,1,[],[],https://twitter.com/WildAstronaut/status/1557356056497606656,False,https://twitter.com/yrmm240/status/1557250572344086529,0,,,,,,,,[],,,,
1557353650397347840,1557350640237551616,2022-08-10 16:10:19 EEST,2022-08-10,16:10:19,+0300,21995528,scaint,Eugene,,"@mr_The У Сільпо наче нормально шукає, але там є ваги, які дуже сильно туплять, наче воно там на якому ангулярі. Інколи незрозуміло, чи то тач не спрацював, чи вони ще думають.",uk,[],[],[],0,0,0,[],[],https://twitter.com/scaint/status/1557353650397347840,False,,0,,,,,,,,"[{'screen_name': 'mr_The', 'name': 'mr.The 🇺🇦 https://comebackalive.in.ua/donate', 'id': '53967484'}]",,,,
1557347741331759104,1557347741331759104,2022-08-10 15:46:50 EEST,2022-08-10,15:46:50,+0300,1239622736038764544,k5gpxdmyz3ctdgz,Віглас Жарделя,,"А гречка у нас теж херсонська? Сука, по 100гривень в Сільпо. Щоб ти, клоун, подавився нею!",uk,[],[],[],0,2,5,[],[],https://twitter.com/k5GPXDMyZ3cTDgz/status/1557347741331759104,False,,0,,,,,,,,[],,,,
1557343007980093440,1557343007980093440,2022-08-10 15:28:01 EEST,2022-08-10,15:28:01,+0300,3315574343,spooky_cat1851,Привид 🇺🇦,,Вийшла в сільпо не вспіла підійти так повітряна тривога,uk,[],[],[],0,0,2,[],[],https://twitter.com/Spooky_cat1851/status/1557343007980093440,False,,0,,,,,,,,[],,,,
1557335004300148738,1557022701239341062,2022-08-10 14:56:13 EEST,2022-08-10,14:56:13,+0300,1397021618,kupurinava,районий якудза,,@DokiDokiPidoras Бо сільпо це граматичний форт Буаяр,uk,[],[],[],0,0,1,[],[],https://twitter.com/kupurinava/status/1557335004300148738,False,,0,,,,,,,,"[{'screen_name': 'DokiDokiPidoras', 'name': 'Doki Doki будівник', 'id': '1405474752'}]",,,,
1557331086656536576,1557022701239341062,2022-08-10 14:40:39 EEST,2022-08-10,14:40:39,+0300,1489914840571420674,arb1tr,ARBITR,,"@_boffin_ @DokiDokiPidoras В Сільпо, здається, той самий fuzzy search працює.",uk,[],[],[],0,0,0,[],[],https://twitter.com/Arb1tr/status/1557331086656536576,False,,0,,,,,,,,"[{'screen_name': '_boffin_', 'name': 'Boffin', 'id': '1509905263578525718'}, {'screen_name': 'DokiDokiPidoras', 'name': 'Doki Doki будівник', 'id': '1405474752'}]",,,,
1557330510183014401,1557330510183014401,2022-08-10 14:38:22 EEST,2022-08-10,14:38:22,+0300,15930637,aleksandrit,oleksandr andrieiko,,Господь послав нам твіти пола массаро замість передбачень в чеках сільпо,uk,[],[],[],0,1,4,[],[],https://twitter.com/aleksandrit/status/1557330510183014401,False,https://twitter.com/apmassaro3/status/1557325044778520576,0,,,,,,,,[],,,,
1557328877080420353,1557328877080420353,2022-08-10 14:31:52 EEST,2022-08-10,14:31:52,+0300,471832901,gidgely,Гандзя,,"На вихідних бачила парочку на Подолі: вона красива і нарядна, він: спить у неї на колінах, поряд з пакетом із Сільпо. У неї на обличчі: повне прийняття ситуації. Романтика.",uk,[],[],[],0,0,0,[],[],https://twitter.com/Gidgely/status/1557328877080420353,False,,0,,,,,,,,[],,,,
1557317969209958402,1557022701239341062,2022-08-10 13:48:32 EEST,2022-08-10,13:48:32,+0300,1553048665937395713,khrysty21648437,Khrystyna,,"@DokiDokiPidoras Я колись (на початках) шукала помідори в Сільпо, а потім дійшло, що в Сільпо помідори елітні, тому вони томати🍅)) А мораль така - мову треба знати, бо не буде вишні😊🍒",uk,[],[],[],0,0,10,[],[],https://twitter.com/Khrysty21648437/status/1557317969209958402,False,,0,,,,,,,,"[{'screen_name': 'DokiDokiPidoras', 'name': 'Doki Doki будівник', 'id': '1405474752'}]",,,,
1557314377384075264,1557313169609064451,2022-08-10 13:34:15 EEST,2022-08-10,13:34:15,+0300,1283873948590133250,smitnyk3,🎄Пес-москалеїдний🖌️♒🇺🇦,,"@AntiX_in_jeans Ну я маю на увазі локшини які є в атб, сільпо, траш, велмарт/велика кишеня і т.д. Мені ше зайшла від Магі, але ціна і кількість не відповідає один одному тому це була одноразова акція",uk,[],[],[],1,0,1,[],[],https://twitter.com/Smitnyk3/status/1557314377384075264,False,,0,,,,,,,,"[{'screen_name': 'AntiX_in_jeans', 'name': 'Antichrist in Jeans 🇺🇦', 'id': '809145708309835776'}]",,,,
1557311219513663494,1557311219513663494,2022-08-10 13:21:42 EEST,2022-08-10,13:21:42,+0300,107186945,chenzana,схематичний заєць,,"наснилось, що дали зп і я пішла витрачати гроші. купляла продукти у 4-поверховому Сільпо. такий приємний сон був",uk,[],[],[],0,0,5,[],[],https://twitter.com/Chenzana/status/1557311219513663494,False,,0,,,,,,,,[],,,,
1557296369349672960,1557022701239341062,2022-08-10 12:22:42 EEST,2022-08-10,12:22:42,+0300,2716994069,sjanciksh,non bene pro toto libertas venditur auro,,"@barmaleykaaaa @DokiDokiPidoras В сільпо ваги на слово лук автоматом підтягують цибулю-той випадок,коли залізяка розумніша за багатьох громадян",uk,[],[],[],0,0,6,[],[],https://twitter.com/Sjanciksh/status/1557296369349672960,False,,0,,,,,,,,"[{'screen_name': 'barmaleykaaaa', 'name': 'бармалейка 🇺🇦', 'id': '1202493640108642304'}, {'screen_name': 'DokiDokiPidoras', 'name': 'Doki Doki будівник', 'id': '1405474752'}]",,,,
1557296209076883461,1557022701239341062,2022-08-10 12:22:04 EEST,2022-08-10,12:22:04,+0300,467557354,reddinka,Діна♥ЗСУ,,"@DokiDokiPidoras Страшніше, коли продавці самі писали цінники на овочі-фрукти в Сільпо колись, дві клієнтки впали під стелаж з реготом бо співробітник написав ""грейфрукт"", а я раз написала ""цибля""",uk,[],[],[],0,0,2,[],[],https://twitter.com/RedDinka/status/1557296209076883461,False,,0,,,,,,,,"[{'screen_name': 'DokiDokiPidoras', 'name': 'Doki Doki будівник', 'id': '1405474752'}]",,,,
1557295294043283456,1557110314851876864,2022-08-10 12:18:25 EEST,2022-08-10,12:18:25,+0300,356278917,i_nonsenses,Миколаївна,,"@junkedjunkie Печиво якесь вершкове з сільпо. І в тому ж сільпо взяла сиркову масу з персиком. Клієнтка порадила, що з нею чізкейк готувати топ. На вигляд як йогурт з шматочками фруктів😋",uk,[],[],[],1,0,1,[],[],https://twitter.com/I_nonsenses/status/1557295294043283456,False,,0,,,,,,,,"[{'screen_name': 'junkedjunkie', 'name': 'Кіборґ Придурок', 'id': '392806435'}]",,,,
1557290087410442245,1557290087410442245,2022-08-10 11:57:44 EEST,2022-08-10,11:57:44,+0300,1164320087807012864,alenka67784640,Соплезуба тигриня,,А у Воронцовському палаці #Сільпо відкриємо  https://t.co/k1d542Li8e,uk,[],[],['https://pbs.twimg.com/media/FZybFFlWAAElhNF.jpg'],0,0,0,['сільпо'],[],https://twitter.com/alenka67784640/status/1557290087410442245,False,,1,https://pbs.twimg.com/media/FZybFFlWAAElhNF.jpg,,,,,,,[],,,,
1557289739853697026,1557289739853697026,2022-08-10 11:56:21 EEST,2022-08-10,11:56:21,+0300,1227569018829234177,_govorukhin,Stanislav Govorukhin 🇺🇦,,"Трапляється, що я розповідаю колишнім колегам з Європи про те, що в Україні створили фундаментально кращі продукти і сервіси — Нову Пошту, Сільпо, Монобанк, Розетку.   Вони дивуються, але одразу згадують про відсутність корупції, якість життя, освіту в себе тощо. Все так, але…",uk,[],[],[],4,0,39,[],[],https://twitter.com/_govorukhin/status/1557289739853697026,False,,0,,,,,,,,[],,,,
1557279836984467457,1557022701239341062,2022-08-10 11:17:00 EEST,2022-08-10,11:17:00,+0300,1318788499961688066,vikno_na_kuhni,Вікно На Кухні,,"@DokiDokiPidoras Але найважче в Сільпо все ж зважити помідори, бо вони - томати :)",uk,[],[],[],2,0,22,[],[],https://twitter.com/Vikno_na_kuhni/status/1557279836984467457,False,,0,,,,,,,,"[{'screen_name': 'DokiDokiPidoras', 'name': 'Doki Doki будівник', 'id': '1405474752'}]",,,,
1557273307002576896,1557271714484068352,2022-08-10 10:51:03 EEST,2022-08-10,10:51:03,+0300,972965099446112256,nezgraba_,Незґраба,,@kkarinelle Пів року на зарплаті піцою з сільпо і горішки з гущонкою.,uk,[],[],[],1,0,0,[],[],https://twitter.com/nezgraba_/status/1557273307002576896,False,,0,,,,,,,,"[{'screen_name': 'kkarinelle', 'name': '🦦війдерка', 'id': '580050046'}]",,,,
1557268039481135104,1557266301139263488,2022-08-10 10:30:07 EEST,2022-08-10,10:30:07,+0300,14094328,tarasmi,Taras,,"@iventts @mudzhyri Я кожного разу, коли ввожу на вагах Сільпо ""помідор"", а треба ""ТОМАТ""  https://t.co/eQvrsNQuyA",uk,[],[],['https://pbs.twimg.com/tweet_video_thumb/FZyHBj_XoAA5QFz.jpg'],0,0,7,[],[],https://twitter.com/tarasmi/status/1557268039481135104,False,,1,https://pbs.twimg.com/tweet_video_thumb/FZyHBj_XoAA5QFz.jpg,,,,,,,"[{'screen_name': 'iventts', 'name': 'Ivan Omelchenko', 'id': '18846819'}, {'screen_name': 'mudzhyri', 'name': 'Yevgeniy Mudzhyri™', 'id': '20973687'}]",,,,
1557267260082880519,1557266301139263488,2022-08-10 10:27:02 EEST,2022-08-10,10:27:02,+0300,18846819,iventts,Ivan Omelchenko,,"@mudzhyri Сільпо вже б могли завести колонку синонімів, для пошуку.  Робиться це реально не складно.",uk,[],[],[],1,0,0,[],[],https://twitter.com/iventts/status/1557267260082880519,False,,0,,,,,,,,"[{'screen_name': 'mudzhyri', 'name': 'Yevgeniy Mudzhyri™', 'id': '20973687'}]",,,,
1557265904307781635,1557264989462974464,2022-08-10 10:21:38 EEST,2022-08-10,10:21:38,+0300,1491887582015328256,katespicegirl,Катязавр 🇺🇦,,"@alkocryer Чи вважається дискримінацією мене те, що вчора в сільпо не було гречаного багету?",uk,[],[],[],1,0,2,[],[],https://twitter.com/katespicegirl/status/1557265904307781635,False,,0,,,,,,,,"[{'screen_name': 'alkocryer', 'name': 'лиза плачет, пьет 🇺🇦', 'id': '907299315915411456'}]",,,,
1557264458719846400,1557233879911727104,2022-08-10 10:15:54 EEST,2022-08-10,10:15:54,+0300,114497721,dfnjyd,dfnjdbjndrher,,"@thenborman @artiom_sue Так так, і батьки знають мову з телевізора. Там не багато про печериць, вишню або огірків розповідають. Лише реклама сільпо. А до 2012 року взагалі рос серіали були лише з субтитрами",uk,[],[],[],1,0,0,[],[],https://twitter.com/dfnjyd/status/1557264458719846400,False,,0,,,,,,,,"[{'screen_name': 'thenborman', 'name': '¯\\_(ツ)_/¯ 🇺🇦', 'id': '937262113600491520'}, {'screen_name': 'artiom_sue', 'name': 'Artem K.', 'id': '62228604'}]",,,,
1557252609567776769,1557252609567776769,2022-08-10 09:28:49 EEST,2022-08-10,09:28:49,+0300,1010085535094919169,elizabethcrash,рест•🐾 리즈 🇺🇦рар🐾,,"сходила у сільпо, гроші покласти на карту і купила собі кока колу, але від живчику, хочу спробувати",uk,[],[],[],0,0,0,[],[],https://twitter.com/elizabethcrash/status/1557252609567776769,False,,0,,,,,,,,[],,,,
1557250097783754752,1557004448404226048,2022-08-10 09:18:50 EEST,2022-08-10,09:18:50,+0300,1358495228534149124,shameless_fem,Кислая Шипучка,,"@vlrsl_ Я живу біля нового ТЦ, що відкрився, то тепер у Сільпо все купую частіше за всього) так добре, що помітно, що є вже багато, що відкрилося) все інше, вірю, теж на часі))",uk,[],[],[],1,0,1,[],[],https://twitter.com/shameless_fem/status/1557250097783754752,False,,0,,,,,,,,"[{'screen_name': 'vlrsl_', 'name': 'Сало 🇺🇦', 'id': '1018526588365869058'}]",,,,
1557249184578805760,1557004448404226048,2022-08-10 09:15:12 EEST,2022-08-10,09:15:12,+0300,1018526588365869058,vlrsl_,Сало 🇺🇦,,"@JustLuForU О, Деліція запрацювала, кайф. Я не знала, до речі, дякую. Сільпо крутий відкрився, трошки далеко від мене, але іноді там буваю. Хочеться звісно, щоб там вже всі магазини відкрилися, бо я бачила тільки дрібні острівки і аптеку.",uk,[],[],[],0,0,1,[],[],https://twitter.com/vlrsl_/status/1557249184578805760,False,,0,,,,,,,,"[{'screen_name': 'JustLuForU', 'name': 'Четверта сестра Дуарте', 'id': '1507606429645037568'}]",,,,
1557185500678602752,1557004448404226048,2022-08-10 05:02:09 EEST,2022-08-10,05:02:09,+0300,1507606429645037568,justluforu,Четверта сестра Дуарте,,"@vlrsl_ До речі, про відновлення: у вас там уже ""Деліція"" працює, я в себе на районі постійно бачу їхнє печиво в ""Сільпо"". Якби знаття, що ці гроші підуть на відновлення міста, постійно купувала б комфортфуд свого дитинства - ""Супермоніку"".",uk,[],[],[],1,0,0,[],[],https://twitter.com/JustLuForU/status/1557185500678602752,False,,0,,,,,,,,"[{'screen_name': 'vlrsl_', 'name': 'Сало 🇺🇦', 'id': '1018526588365869058'}]",,,,
1557137908313751552,1557074073699733504,2022-08-10 01:53:02 EEST,2022-08-10,01:53:02,+0300,1506754620676268038,yuliia_notes,Yuliia Notes,,"@mahaladze @Sombre_unicorn я так далеко не заїжджала, але сільпо продає все",uk,[],[],[],0,0,0,[],[],https://twitter.com/yuliia_notes/status/1557137908313751552,False,,0,,,,,,,,"[{'screen_name': 'mahaladze', 'name': 'Бена Махаладзе', 'id': '1524360045072461829'}, {'screen_name': 'Sombre_unicorn', 'name': 'Олівка 🇺🇦', 'id': '761836081054638080'}]",,,,
1557133465979584515,1557074073699733504,2022-08-10 01:35:23 EEST,2022-08-10,01:35:23,+0300,1524360045072461829,mahaladze,Бена Махаладзе,,"@yuliia_notes @Sombre_unicorn Сільпо вже не продає м'ясо блакитної акули, що у  Міжнародній Червоній книзі?",uk,[],[],[],1,0,0,[],[],https://twitter.com/mahaladze/status/1557133465979584515,False,,0,,,,,,,,"[{'screen_name': 'yuliia_notes', 'name': 'Yuliia Notes', 'id': '1506754620676268038'}, {'screen_name': 'Sombre_unicorn', 'name': 'Олівка 🇺🇦', 'id': '761836081054638080'}]",,,,
1557115810820378629,1557115810820378629,2022-08-10 00:25:13 EEST,2022-08-10,00:25:13,+0300,1498664697620484098,ray_blog,Промінчик🔆(Рей),,"Чекаю на Сільпо, оформлене в стилі  ЗСУ і хейту русні😅 @silpo_ua",uk,"[{'screen_name': 'silpo_ua', 'name': 'сільпо', 'id': '1111277205173272576'}]",[],[],0,0,1,[],[],https://twitter.com/Ray_blog/status/1557115810820378629,False,,0,,,,,,,,[],,,,
1557108692822249472,1557108692822249472,2022-08-09 23:56:56 EEST,2022-08-09,23:56:56,+0300,1467756654766833664,victoriaonufer,Victoriа Sakura,,Піду зранку в сільпо за пахлавою⛵,uk,[],[],[],0,0,0,[],[],https://twitter.com/VictoriaOnufer/status/1557108692822249472,False,,0,,,,,,,,[],,,,
1557102679079489536,1557047779264012288,2022-08-09 23:33:02 EEST,2022-08-09,23:33:02,+0300,1494668787160952838,itztruejoker,швайноєнот,,@smark_n Так сходи в сільпо й там приготуй. Буде як в сільпо,uk,[],[],[],0,0,1,[],[],https://twitter.com/itztruejoker/status/1557102679079489536,False,,0,,,,,,,,"[{'screen_name': 'smark_n', 'name': 'стала кем думала быть нельзя', 'id': '1490787152510296070'}]",,,,
1557098210371551234,1557083015469273090,2022-08-09 23:15:17 EEST,2022-08-09,23:15:17,+0300,1508045849762402311,nlawchyk,я,,"@m_mariyaaaa @tanyaswiter аа, не знаю, не чув але за піцу з Фори і Сільпо я б позмагався",uk,[],[],[],2,0,1,[],[],https://twitter.com/nlawchyk/status/1557098210371551234,False,,0,,,,,,,,"[{'screen_name': 'm_mariyaaaa', 'name': 'Марія Маковецька', 'id': '1477695828374568964'}, {'screen_name': 'tanyaswiter', 'name': 'це я з блендером', 'id': '2460318999'}]",,,,
1557095120658374656,1557054120892276736,2022-08-09 23:03:00 EEST,2022-08-09,23:03:00,+0300,1116335261988925440,verstyukivan,Ivan Verstyuk,,"@bilkakopalka @rozetka_ua @allo @citrus__ua @ukrposhta @_novaposhta_ @atb_market_tm @TwiyKyivstar Поржав. А ти як живеш? Білка як ззість корму того, що в ""Сільпо"" продають, то може й пропучити добряче ггггггг",uk,[],[],[],1,0,1,[],[],https://twitter.com/VerstyukIvan/status/1557095120658374656,False,,0,,,,,,,,"[{'screen_name': 'bilkakopalka', 'name': '🇺🇦 ꑭ Білка-копалка ꑭ 🇺🇦', 'id': '1497960784055488519'}, {'screen_name': 'rozetka_ua', 'name': 'Rozetka', 'id': '219635045'}, {'screen_name': 'allo', 'name': 'Алло', 'id': '342589036'}, {'screen_name': 'citrus__ua', 'name': 'Цитрус', 'id': '56640743'}, {'screen_name': 'ukrposhta', 'name': 'Укрпошта', 'id': '594518852'}, {'screen_name': '_novaposhta_', 'name': 'Нова пошта', 'id': '1154413177'}, {'screen_name': 'atb_market_tm', 'name': 'АТБ-маркет', 'id': '564482967'}, {'screen_name': 'TwiyKyivstar', 'name': 'Kyivstar', 'id': '130165166'}]",,,,
1557090245191127040,1557090245191127040,2022-08-09 22:43:38 EEST,2022-08-09,22:43:38,+0300,1533143472294793216,stefanovavero,Пані Стефанова 🌿🇺🇦,,"Хтось: вегани їдять здорову та несмачну їжу  Я та моя цукрова пачка Pedro з Сільпо: ""ну ну"" ))  https://t.co/jMzcE8ht2O",uk,[],[],['https://pbs.twimg.com/media/FZvlU1WXoAEV4Jq.jpg'],0,0,3,[],[],https://twitter.com/stefanovavero/status/1557090245191127040,False,,1,https://pbs.twimg.com/media/FZvlU1WXoAEV4Jq.jpg,,,,,,,[],,,,
1557089733020459009,1557088308538261505,2022-08-09 22:41:36 EEST,2022-08-09,22:41:36,+0300,1465422343577210889,vashlogist,"кицюш, да ето так🇺🇦",,"@schayno_karas мені в сільпо завжди снився аутлук, що листи по поставках приходять, один раз навіть віщий був🙃",uk,[],[],[],0,0,1,[],[],https://twitter.com/vashlogist/status/1557089733020459009,False,,0,,,,,,,,"[{'screen_name': 'schayno_karas', 'name': '🇺🇦МC Петя', 'id': '1513081517190393857'}]",,,,
1557088087989276676,1557074073699733504,2022-08-09 22:35:04 EEST,2022-08-09,22:35:04,+0300,1506754620676268038,yuliia_notes,Yuliia Notes,,@Sombre_unicorn наші бренди – найкращі. я вже це писала про сільпо,uk,[],[],[],1,2,200,[],[],https://twitter.com/yuliia_notes/status/1557088087989276676,False,,0,,,,,,,,"[{'screen_name': 'Sombre_unicorn', 'name': 'Олівка 🇺🇦', 'id': '761836081054638080'}]",,,,
1557087909165105152,1556983720795676673,2022-08-09 22:34:21 EEST,2022-08-09,22:34:21,+0300,2776440236,miss_cloudlet_,"ꑭ Та, що ходе поміж хмар 💙вірю у воїнів України💛",,"@strykoza_ua Сільпо, бум ласка 🤌",uk,[],[],[],0,0,5,[],[],https://twitter.com/miss_cloudlet_/status/1557087909165105152,False,,0,,,,,,,,"[{'screen_name': 'strykoza_ua', 'name': 'стрикоза ꑭ 🇺🇦', 'id': '482947076'}]",,,,
